places,weather_conditions,causes_by,impacts
"Caraga, Davao Region, and Palawan",Cloudy skies with scattered rains and thunderstorms,ITCZ,Possible flash floods or landslides due to moderate to at times heavy rains
"Bicol Region, Quezon, Northern Samar, and Eastern Samar",Cloudy skies with scattered rains and thunderstorms,Easterlies,Possible flash floods or landslides due to moderate to at times heavy rains
"Cagayan Valley, Apayao, Kalinga, Mountain Province, Ifugao, and Aurora",Cloudy skies with rains,Northeast Monsoon,Possible flash floods or landslides due to moderate to at times heavy rains
"Ilocos Region, the rest of Cordillera Administrative Region, and the rest of Central Luzon",Partly cloudy to cloudy skies with isolated light rains,Northeast Monsoon,No significant impact
Metro Manila and the rest of the country,Partly cloudy to cloudy skies with isolated rainshowers or thunderstorms,Easterlies,Possible flash floods or landslides due to severe thunderstorms
