places,weather_conditions,causes_by,impacts,issued_datetime,issued_datetimes
"Isabela, Aurora, Quezon, and Mainland Cagayan",Cloudy skies with scattered rains and isolated thunderstorms,Shear Line,Possible flash floods or landslides due to moderate to at times heavy rains,,"Issued at: 4:00 PM, 21 December 2025"
"Visayas, MIMAROPA, Bicol Region, Dinagat Islands, Surigao del Norte, Surigao del Sur, and Davao Oriental",Cloudy skies with scattered rains and thunderstorms,Easterlies,Possible flash floods or landslides due to moderate to at times heavy rains,,"Issued at: 4:00 PM, 21 December 2025"
"Batanes, Babuyan Islands, Apayao, Kalinga, and Ilocos Norte",Cloudy skies with rains,Northeast Monsoon,Possible flash floods or landslides due to moderate to at times heavy rains,,"Issued at: 4:00 PM, 21 December 2025"
The rest of Ilocos Region and the rest of Cordillera Administrative Region,Partly cloudy to cloudy skies with isolated light rains,Northeast Monsoon,No significant impact,,"Issued at: 4:00 PM, 21 December 2025"
Metro Manila and the rest of the country,Partly cloudy to cloudy skies with isolated rainshowers or thunderstorms,Easterlies,Possible flash floods or landslides during severe thunderstorms,,"Issued at: 4:00 PM, 21 December 2025"
